{
  "generated_at": "2025-08-12T09:08:40.714Z",
  "companies": [
    {
      "id": 1,
      "name": "三菱UFJ銀行"
    }
  ],
  "evidence": [
    {
      "company_id": 1,
      "source_url": "https://www.bk.mufg.jp/kigyou/profile.html",
      "source_type": "web",
      "value": 31756,
      "raw_text": "継続計画 金融機関コード（銀行コード）：0005 会社概要 名称 株式会社三菱ＵＦＪ銀行 英語表記：MUFG Bank, Ltd. 金融機関コード （銀行コード） 0005 代表者氏名 取締役頭取執行役員 半沢 淳一 資本金 17,119億円（単体） 株主 株式会社三菱ＵＦＪフィナンシャル・グループ（100％） 三菱ＵＦＪフィナンシャル・グループ 設立日 1919年（大正8年） 8月15日 沿革 従業員数 31,756名（2024年3月末現在、単体） 支店等 国内 421、海外104（2024年3月末現在） 本店所在地 東京都千代田区丸の内一丁目4番5号 地図 信託契約代理店登録票 信託契約代理業 登録番号 関東財務局長（代信）第５７号 信託契約代理店 株式会社三菱ＵＦＪ銀行 所属信託会社 三菱ＵＦＪ信託銀行株式会社 外国銀行代理銀行届出票 外国銀行代理業務 (銀行法第52条の2の9第2項の規定による届出) 届出",
      "model": "regex",
      "score": 0.95,
      "page_title": "会社概要 | 三菱ＵＦＪ銀行",
      "extracted_at": "2025-08-12T00:08:34.000Z",
      "status_code": 200,
      "snippet_start": 401,
      "snippet_end": 413
    }
  ],
  "review_state": []
}